<?xml version="1.0" encoding="UTF-8"?>
<?xml-stylesheet type="text/css" href="style.css"?>
<!DOCTYPE taskList SYSTEM "tasks.dtd">
<taskList>
    <task id="1" description="Complete project proposal" priority="High" status="Incomplete"/>
    <task id="2" description="Attend team meeting" priority="Medium" status="Complete"/>
    <task id="3" description="Review code changes" priority="Low" status="Incomplete"/>
    <task id="4" description="Prepare presentation slides" priority="Medium" status="Incomplete"/>
    <task id="5" description="Coordinate with clients" priority="High" status="Incomplete"/>
    <task id="6" description="Update project documentation" priority="Low" status="Complete"/>
    <task id="7" description="Test new software features" priority="High" status="Incomplete"/>
    <task id="8" description="Create weekly progress report" priority="Medium" status="Incomplete"/>
    <task id="9" description="Conduct training session" priority="Low" status="Complete"/>
    <task id="10" description="Resolve customer support tickets" priority="Medium" status="Incomplete"/>
</taskList>
